LEAVEID	EMPLOYEEID	DATE	LEAVE TYPE	LEAVE START	LEAVE END	MESSAGE	STATUS
001	1	03/25/2024	Vacation	02/03/2024	02/05/2024	REQUEST FOR YOUR APPROVAL	PENDING
002	1	03/25/2024	Vacation	02/03/2024	02/05/2024	REQUEST FOR YOUR APPROVAL	APPROVE
003	1	03/25/2024	Sick	02/03/2024	02/05/2024	REQUEST FOR YOUR APPROVAL	REJECT
004	1	03/26/2024	Vacation	03/25/2024	03/26/2024	Hi Hello	pending
005	1	03/26/2024	Emergency	02/25/2024	02/26/2024	Hi hello ahow rsakdj	pending
006	1	03/26/2024	Emergency	03/25/2024	03/26/2024	hi how are your my friend	pending
